{
  "schema_version": "1.0.0",
  "repository": "Ottili-ONE/skills",
  "packages": {
    "agentic-data": {
      "label": "Agentic-data",
      "description": "Skills in the agentic-data package.",
      "path": "skills/agentic-data"
    },
    "business-de": {
      "label": "Business-de",
      "description": "Skills in the business-de package.",
      "path": "skills/business-de"
    },
    "core": {
      "label": "Core",
      "description": "Skills in the core package.",
      "path": "skills/core"
    },
    "curated": {
      "label": "Curated",
      "description": "Skills in the curated package.",
      "path": "skills/curated"
    },
    "engineering": {
      "label": "Engineering",
      "description": "Skills in the engineering package.",
      "path": "skills/engineering"
    },
    "orchestrator-preamble": {
      "label": "Orchestrator-preamble",
      "description": "Skills in the orchestrator-preamble package.",
      "path": "skills/orchestrator-preamble"
    },
    "ref-bank-reconciliation-camt": {
      "label": "Ref-bank-reconciliation-camt",
      "description": "Skills in the ref-bank-reconciliation-camt package.",
      "path": "skills/ref-bank-reconciliation-camt"
    },
    "ref-datev-extf": {
      "label": "Ref-datev-extf",
      "description": "Skills in the ref-datev-extf package.",
      "path": "skills/ref-datev-extf"
    },
    "ref-gobd-archive": {
      "label": "Ref-gobd-archive",
      "description": "Skills in the ref-gobd-archive package.",
      "path": "skills/ref-gobd-archive"
    },
    "ref-ust-edge-cases": {
      "label": "Ref-ust-edge-cases",
      "description": "Skills in the ref-ust-edge-cases package.",
      "path": "skills/ref-ust-edge-cases"
    },
    "ref-webhooks-safe": {
      "label": "Ref-webhooks-safe",
      "description": "Skills in the ref-webhooks-safe package.",
      "path": "skills/ref-webhooks-safe"
    },
    "ref-xrechnung-zugferd": {
      "label": "Ref-xrechnung-zugferd",
      "description": "Skills in the ref-xrechnung-zugferd package.",
      "path": "skills/ref-xrechnung-zugferd"
    }
  },
  "skills": [
    {
      "id": "browser-agent-playwright",
      "name": "browser-agent-playwright",
      "title": "Browser Agent Playwright",
      "version": "",
      "package": "agentic-data",
      "path": "skills/agentic-data/browser-agent-playwright",
      "category": "",
      "license": "MIT",
      "author": "",
      "compatibility": [
        "Playwright 1.49+ (verified 1.64.0 on 2026-10-13, PyPI latest); Node/Python/Go drivers"
      ],
      "description": "Drive a browser with Playwright for agents: grounding in DOM/ARIA, robust locators, network waits, prompt-injection defense for page content, and safe hand-off between browser and code. Use when an agent must scrape, test, or automate a site; never use raw page.evaluate for extraction; not for server-side scraping or non-browser automation. Verified 2026-10-14.",
      "paths": [
        "skills/agentic-data/browser-agent-playwright/SKILL.md",
        "skills/agentic-data/browser-agent-playwright/references/DESIGN.md",
        "skills/agentic-data/browser-agent-playwright/references/EVALS.md",
        "skills/agentic-data/browser-agent-playwright/references/SOURCES.md",
        "skills/agentic-data/browser-agent-playwright/references/bo-n-jailbreak.md",
        "skills/agentic-data/browser-agent-playwright/references/decision-tables.md",
        "skills/agentic-data/browser-agent-playwright/references/handoff.md",
        "skills/agentic-data/browser-agent-playwright/references/injection-decision.md",
        "skills/agentic-data/browser-agent-playwright/references/injection-defense.md",
        "skills/agentic-data/browser-agent-playwright/references/locator-catalog.md",
        "skills/agentic-data/browser-agent-playwright/references/network-waits.md",
        "skills/agentic-data/browser-agent-playwright/references/procedures.md",
        "skills/agentic-data/browser-agent-playwright/scripts/bon_cap.py",
        "skills/agentic-data/browser-agent-playwright/scripts/gen_hostile.py",
        "skills/agentic-data/browser-agent-playwright/scripts/handoff.py",
        "skills/agentic-data/browser-agent-playwright/scripts/sanitize.py",
        "skills/agentic-data/browser-agent-playwright/scripts/validate_skill.py",
        "skills/agentic-data/browser-agent-playwright/tests/test_bon_cap.py",
        "skills/agentic-data/browser-agent-playwright/tests/test_handoff.py",
        "skills/agentic-data/browser-agent-playwright/tests/test_roundtrip.py",
        "skills/agentic-data/browser-agent-playwright/tests/test_sanitize.py"
      ]
    },
    {
      "id": "computer-use-drivers",
      "name": "computer-use-drivers",
      "title": "Computer Use Drivers",
      "version": "",
      "package": "agentic-data",
      "path": "skills/agentic-data/computer-use-drivers",
      "category": "",
      "license": "MIT",
      "author": "",
      "compatibility": [
        "macOS (AX), Windows (UIA), Linux (X11/Wayland); Python 3.10+"
      ],
      "description": "Drive desktop and remote apps through accessibility trees and background input with safety layers: coordinate scaling, confirm() gates on destructive actions, screen-as-untrusted-data handling, platform quirks (macOS AX, Windows UIA, X11/Wayland). Use when an agent must click, type into or scroll an app it cannot reach through its API; never use raw screen scraping as the primary path. Verified 2026-10-13.",
      "paths": [
        "skills/agentic-data/computer-use-drivers/SKILL.md",
        "skills/agentic-data/computer-use-drivers/fixtures/registry_20260801.json",
        "skills/agentic-data/computer-use-drivers/fixtures/sample_driver.py",
        "skills/agentic-data/computer-use-drivers/references/DESIGN.md",
        "skills/agentic-data/computer-use-drivers/references/EVALS.md",
        "skills/agentic-data/computer-use-drivers/references/SOURCES.md",
        "skills/agentic-data/computer-use-drivers/references/coordinate-scaling.md",
        "skills/agentic-data/computer-use-drivers/references/examples.md",
        "skills/agentic-data/computer-use-drivers/references/platform-quirks.md",
        "skills/agentic-data/computer-use-drivers/references/procedures.md",
        "skills/agentic-data/computer-use-drivers/references/safety-layers.md",
        "skills/agentic-data/computer-use-drivers/references/tree-protocol.md",
        "skills/agentic-data/computer-use-drivers/scripts/validate_driver.py",
        "skills/agentic-data/computer-use-drivers/tests/test_validate_driver.py"
      ]
    },
    {
      "id": "dedup-decontam",
      "name": "dedup-decontam",
      "title": "Dedup Decontam",
      "version": "",
      "package": "agentic-data",
      "path": "skills/agentic-data/dedup-decontam",
      "category": "",
      "license": "MIT",
      "author": "",
      "compatibility": [
        "Python 3.10+, numpy optional; verified 2026-10-14"
      ],
      "description": "Deduplicate and decontaminate text corpora for LLM training: MinHash/LSH near-duplicate detection, n-gram and embedding-based decontamination, planted-item tests with pass/fail criteria. Use when preparing a training or evaluation dataset and you must remove duplicates and test-set leakage; not for single-document similarity.",
      "paths": [
        "skills/agentic-data/dedup-decontam/SKILL.md",
        "skills/agentic-data/dedup-decontam/references/DESIGN.md",
        "skills/agentic-data/dedup-decontam/references/EVALS.md",
        "skills/agentic-data/dedup-decontam/references/SOURCES.md",
        "skills/agentic-data/dedup-decontam/references/planted-item-tests.md",
        "skills/agentic-data/dedup-decontam/references/procedures.md",
        "skills/agentic-data/dedup-decontam/scripts/embed_decontam.py",
        "skills/agentic-data/dedup-decontam/scripts/minhash_lsh.py",
        "skills/agentic-data/dedup-decontam/scripts/ngram_decontam.py",
        "skills/agentic-data/dedup-decontam/scripts/normalize.py",
        "skills/agentic-data/dedup-decontam/scripts/plant_test.py",
        "skills/agentic-data/dedup-decontam/scripts/validate_skill.py",
        "skills/agentic-data/dedup-decontam/tests/test_dedup_scripts.py",
        "skills/agentic-data/dedup-decontam/tests/test_pipeline.py"
      ]
    },
    {
      "id": "deep-research-method",
      "name": "deep-research-method",
      "title": "Deep Research Method",
      "version": "",
      "package": "agentic-data",
      "path": "skills/agentic-data/deep-research-method",
      "category": "",
      "license": "MIT",
      "author": "",
      "compatibility": [
        "Ottili research workflow; generic (no platform dependency)"
      ],
      "description": "Run evidence-backed research for Ottili agents: score sources 0-10 (authority/recency/corroboration, keep >=6), cite every claim with URL + retrieval date + pinned version, resolve contradictions by quality weight, and state confidence high/medium/low. Use when an agent must answer a question from the web, write a research brief, audit a source, or decide which of two conflicting facts to trust. Not for reading a single known-good document.",
      "paths": [
        "skills/agentic-data/deep-research-method/SKILL.md",
        "skills/agentic-data/deep-research-method/references/DESIGN.md",
        "skills/agentic-data/deep-research-method/references/EVALS.md",
        "skills/agentic-data/deep-research-method/references/SOURCES.md",
        "skills/agentic-data/deep-research-method/references/citation-discipline.md",
        "skills/agentic-data/deep-research-method/references/cite-fetch.md",
        "skills/agentic-data/deep-research-method/references/confidence-ladder.md",
        "skills/agentic-data/deep-research-method/references/contradiction-handling.md",
        "skills/agentic-data/deep-research-method/references/examples.md",
        "skills/agentic-data/deep-research-method/references/incidents.md",